document_id,category,original_text,stemmed_text,word_count,keyword_percentage
847,Engineering_Profession,"E-commerce trust has becoming the bottleneck of the development of e-commerce in China, which attracts much attention of many researchers. However, the empirical researches of e-commerce trust are very few, so most of research productions lack of persuasion. This text presents an evaluation system of B2C e-commerce trust, which may promote the development of empirical research in China. And then, this text gives an example of empirical research of B2C e-commerce trust, demonstrates how to do empirical research, which may direct the empirical research in China","e-commerce trust have become the bottleneck of the development of e-commerce in china , which attract much attention of many researcher . however , the empirical research of e-commerce trust be very few , so most of research production lack of persuasion . this text present an evaluation system of b2c e-commerce trust , which may promote the development of empirical research in china . and then , this text give an example of empirical research of b2c e-commerce trust , demonstrate how to do empirical research , which may direct the empirical research in china",86,0.75
848,Engineering_Profession,"This paper constructs a model of subjective interestingness in order to study the differences among customer purchase patterns. Firstly, traditional purchase patterns can be found by using mining algorithms for association rules and they are considered as some beliefs of the model, that is, some generally acknowledged laws. Then from each type of customer group, we can find some new purchase patterns. Next, the subjective interestingness values of the new patterns can be computed by comparing these new purchase patterns with existing beliefs. Thus we can get the subjective interestingness value of each customer group. The customer groups with low interestingness values indicate that their purchase behaviors are similar to those we have found and so we can use the existing patterns to represent the customers' behaviors, whereas for the customer groups with high interestingness values, their purchase behaviors are very different from common customers, and the existing purchase patterns can not represent these customers' behaviors, so these customers are of great value to further research.","this paper construct a model of subjective interestingness in order to study the difference among customer purchase pattern . firstly , traditional purchase pattern can be find by use mining algorithm for association rule and they be consider as some belief of the model , that be , some generally acknowledged law . then from each type of customer group , we can find some new purchase pattern . next , the subjective interestingness value of the new pattern can be compute by compare these new purchase pattern with exist belief . thus we can get the subjective interestingness value of each customer group . the customer group with low interestingness value indicate that their purchase behavior be similar to those we have find and so we can use the exist pattern to represent the customer ' behavior , whereas for the customer group with high interestingness value , their purchase behavior be very different from common customer , and the exist purchase pattern can not represent these customer ' behavior , so these customer be of great value to further research .",166,0.75
849,Engineering_Profession,"GIS is a tool for spatial-related data processing and decision making. Handling decision making under high quality data is a further extension of GIS functions. Therefore, it is of vital importance to assess data quality in GIS and to decide the fitness of data to user's particular applications. We present a methodology to determine two data quality characteristics - accuracy and completeness - that are of critical importance to decision makers. We examine how the quality metrics of source data affect the quality for information outputs produced using the relational algebra operations Selection, Projection, and Cartesian product. Our methodology can help users deciding the fitness of spatial data to their GIS applications according to the quality levels much efficiently.","gi be a tool for spatial-related data processing and decision making . handle decision make under high quality data be a further extension of gi function . therefore , it be of vital importance to assess data quality in gi and to decide the fitness of data to user 's particular application . we present a methodology to determine two data quality characteristic - accuracy and completeness - that be of critical importance to decision maker . we examine how the quality metric of source data affect the quality for information output produce use the relational algebra operation selection , projection , and cartesian product . our methodology can help user decide the fitness of spatial data to their gi application accord to the quality level much efficiently .",119,0.5
850,Engineering_Profession,"Sentiment classification aims at mining opinions of customers for a certain product by automatically classifying the reviews into positive or negative opinions. With the fast developing of World Wide Web applications, sentiment classification would have huge opportunity to help automatic analysis of customerspsila opinions from the web information. Opinion mining will benefit both consumers and sellers. Up to now, it is still a complicated task with great challenge. Though some pioneer researches explored the approaches for English review classification, few works have been done on sentiment classification for Chinese reviews. In this paper, we focus on a specific domain-cell phone review and propose an Internet-based approach for Chinese product review mining. The experimental results show the effectiveness of the proposed approach in sentiment classification for Chinese product reviews.","sentiment classification aim at mine opinion of customer for a certain product by automatically classify the review into positive or negative opinion . with the fast develop of world wide web application , sentiment classification would have huge opportunity to help automatic analysis of customerspsila opinion from the web information . opinion mining will benefit both consumer and seller . up to now , it be still a complicated task with great challenge . though some pioneer research explore the approach for english review classification , few work have be do on sentiment classification for chinese review . in this paper , we focus on a specific domain-cell phone review and propose an internet-based approach for chinese product review mining . the experimental result show the effectiveness of the proposed approach in sentiment classification for chinese product review .",128,0.5
851,Engineering_Profession,"The paper is motivated by Microsoft Windows and Linux competition at the server operating systems market. Microsoft/Linux mixed duopoly dynamics is analyzed using optimal control mathematical model where Microsoft is considered as a profit-maximizing competitor while Linux as an open source software project is assumed non-for-profit. The conditions when Linux And Windows coexist at the market and when Linux is pushed out by Windows and vice versa are obtained and discussed. The special attention in the model presented is given to a piracy of Windows and strategic contribution to Linux issues which for the first time were discussed also by Cassadeus-Masanell and Ghemawat (2006).","the paper be motivate by microsoft window and linux competition at the server operate system market . microsoft/linux mixed duopoly dynamic be analyze use optimal control mathematical model where microsoft be consider as a profit-maximizing competitor while linux as an open source software project be assume non-for-profit . the condition when linux and window coexist at the market and when linux be push out by window and vice versa be obtain and discuss . the special attention in the model present be give to a piracy of window and strategic contribution to linux issue which for the first time be discuss also by cassadeus-masanell and ghemawat -LRB- 2006 -RRB- .",104,0.8
852,Engineering_Profession,"With the fast development of information technologies implementation, Enterprise resource planning (ERP) systems are increasingly adopted by more large and medium-size companies in China. For most Chinese companies, ERP is still in its planning or initializing stages. Managers in those firms are expecting to know more about what will happen and what they need do after the ERP implementation. Even though some researches about ERP usage in other countries can benefit Chinese practitioners, there is little research on the process of post ERP implementation in China itself. Based on interviews in two manufacturing firms in northeast of China, this study aims to explore the general process of the ERP usage after implementation in Chinese companies from the perspective of ERP performance. According to the differences of ERP performance, four stages are identified as ldquoPassion of noveltyrdquo, ldquoShake-downrdquo, ldquoFast improvingrdquo, and ldquoStably and continuously improvingrdquo. Our findings extend prior studies on the stages of ERP performance.","with the fast development of information technology implementation , enterprise resource planning -LRB- erp -RRB- system be increasingly adopt by more large and medium-size company in china . for most chinese company , erp be still in its planning or initialize stage . manager in those firm be expect to know more about what will happen and what they need do after the erp implementation . even though some research about erp usage in other country can benefit chinese practitioner , there be little research on the process of post erp implementation in china itself . base on interview in two manufacturing firm in northeast of china , this study aim to explore the general process of the erp usage after implementation in chinese company from the perspective of erp performance . accord to the difference of erp performance , four stage be identify as ldquopassion of noveltyrdquo , ldquoshake-downrdquo , ldquofast improvingrdquo , and ldquostably and continuously improvingrdquo . our finding extend prior study on the stage of erp performance .",155,0.75
853,Engineering_Profession,"In order to reduce the impact of inclusion of citations and references during the detection of plagiarism in academic theses, and extract the original content, the author created three ways to extract original content and remove the citation: 1) Removal of normative citations by symbol features; 2) removal tacit citations by Bayesian method based on the minimum risk and thesis structure; 3) removal common knowledge base on domain public knowledge base. The research results show that during the extraction of original content, the precision decreases as the risk coefficient increases, while the recall rate increases with the risk coefficient. When the risk coefficient is 60, the whole performance achieves the optimum. Plagiarism detection after extracting the original content presents a fault rate decrease from 9.09% to 4.52%.","in order to reduce the impact of inclusion of citation and reference during the detection of plagiarism in academic thesis , and extract the original content , the author create three way to extract original content and remove the citation : 1 -RRB- removal of normative citation by symbol feature ; 2 -RRB- removal tacit citation by bayesian method base on the minimum risk and thesis structure ; 3 -RRB- removal common knowledge base on domain public knowledge base . the research result show that during the extraction of original content , the precision decrease as the risk coefficient increase , while the recall rate increase with the risk coefficient . when the risk coefficient be 60 , the whole performance achieve the optimum . plagiarism detection after extract the original content present a fault rate decrease from 9.09 % to 4.52 % .",127,0.4
854,Engineering_Profession,"Management of data quality has become the bottleneck for enterprises to upgrade their application of information technology (IT). Based on the theory of total quality management, this paper presents five influencing factors of data quality from the perspective of organizational management, namely top management support, capability on regulation and process management, business-IT alignment, staff participation and integration of information systems (IS). At the same time, this paper establishes a process model of influencing factors, and conducts an empirical analysis through a field study of 185 enterprises. The results show that the influence of five factors presents transfer characteristics clearly. Top management support has an effect upon the capability on regulation and process management, and business-IT alignment directly, while indirectly on staff participation and integration of IS. Capability on regulation and process management, and business-IT alignment exert a direct impact on staff participation and integration of IS, while indirectly on data quality. Staff participation and integration of IS shows a direct impact on data quality. Finally, this paper presents some suggestions on improving data quality.","management of data quality have become the bottleneck for enterprise to upgrade their application of information technology -LRB- it -RRB- . base on the theory of total quality management , this paper present five influence factor of data quality from the perspective of organizational management , namely top management support , capability on regulation and process management , business-it alignment , staff participation and integration of information system -LRB- be -RRB- . at the same time , this paper establish a process model of influence factor , and conduct an empirical analysis through a field study of 185 enterprise . the result show that the influence of five factor present transfer characteristic clearly . top management support have an effect upon the capability on regulation and process management , and business-it alignment directly , while indirectly on staff participation and integration of be . capability on regulation and process management , and business-it alignment exert a direct impact on staff participation and integration of be , while indirectly on data quality . staff participation and integration of be show a direct impact on data quality . finally , this paper present some suggestion on improve data quality .",174,1
855,Engineering_Profession,"In multi-instance learning, the training set comprises labeled bags which are composed of unlabeled instances, and the task is to predict the labels of unseen bags. In this paper, a text mining problem, i.e. text representation, is investigated from a multi-instance view. In detail, each text is regarded as a bag while each of its sentences is regarded as an instance. Bag can be labeled by its class label and its similarity is defined by sentence similarity. The text classification problem is translated into multi-instance learning problem. In order to solve this problem, a Chinese text classifier focusing on bag has been built by KNN algorithm and good average precision 92.12% and recall 92.01% have been achieved in the experiments.","in multi-instance learning , the training set comprise label bag which be compose of unlabeled instance , and the task be to predict the label of unseen bag . in this paper , a text mining problem , i.e. text representation , be investigate from a multi-instance view . in detail , each text be regard as a bag while each of its sentence be regard as an instance . bag can be label by its class label and its similarity be define by sentence similarity . the text classification problem be translate into multi-instance learning problem . in order to solve this problem , a chinese text classifier focus on bag have be build by knn algorithm and good average precision 92.12 % and recall 92.01 % have be achieve in the experiment .",120,0.75
856,Engineering_Profession,"By using methods of bibliometrics and social network analysis, we find that the scientific collaboration network in China's management science is a scale-free small world network. Based on statistical analysis of the key network properties (L, the average shortest path length; C, the clustering coefficient; the node degree distribution), we explored the relationships between L and the size of China's management science collaboration network, between C and the network density, and between the degree distribution and the strength of node connectivity. The combination of these results shows the current status of China's management science as an academic field. We also divided the period of study into 3 sub-periods and performed analysis on each sub-period. The temporal study shows the trend in China's management science research. By looking into the authors with high node degrees, we also find the hot research area, the most active researchers and organizations.","by use method of bibliometric and social network analysis , we find that the scientific collaboration network in china 's management science be a scale-free small world network . base on statistical analysis of the key network property -LRB- l , the average shortest path length ; c , the cluster coefficient ; the node degree distribution -RRB- , we explore the relationship between l and the size of china 's management science collaboration network , between c and the network density , and between the degree distribution and the strength of node connectivity . the combination of these result show the current status of china 's management science as an academic field . we also divide the period of study into 3 sub-period and perform analysis on each sub-period . the temporal study show the trend in china 's management science research . by look into the author with high node degree , we also find the hot research area , the most active researcher and organization .",147,0.6
857,Engineering_Profession,"The ability to efficiently and effectively select the inter-organizational and heterogeneous services is the important support for the development of the Web service technology. Quality of service (QoS) profiles of Web services are crucial in determining which service best addresses the user desires and objectives. This paper developed a general QoS-based service selection method. By importing the proposed QoS ontology into OWL-S standards, the method can express Web service's nonfunctional attributes in a semantic and extensible way. Web service QoS based selection is formulated as a multi-criteria decision making (MCDM) which can be solved by using different MCDM models to evaluate QoS criteria of the candidate Web services. The values of quality parameters of a Web service are normalized to a non-negative real-valued number where higher normalized values represent higher levels of service performance. The proposed approach can be used as a solution for the complexity and reliability Web service selection problem.","the ability to efficiently and effectively select the inter-organizational and heterogeneous service be the important support for the development of the web service technology . quality of service -LRB- qo -RRB- profile of web service be crucial in determine which service best address the user desire and objective . this paper develop a general qos-based service selection method . by import the propose qo ontology into owl-s standard , the method can express web service 's nonfunctional attribute in a semantic and extensible way . web service qo base selection be formulate as a multi-criteria decision make -LRB- mcdm -RRB- which can be solve by use different mcdm model to evaluate qo criterion of the candidate web service . the value of quality parameter of a web service be normalize to a non-negative real-valued number where high normalized value represent high level of service performance . the proposed approach can be use as a solution for the complexity and reliability web service selection problem .",152,0.8
858,Engineering_Profession,"The development and application of data mining technology puts forward new requirement to knowledge management in information era. Intelligent knowledge is the valuable knowledge that comes from data mining technology, and has the intelligent features such as memory, recognition, self-updating, disappearance etc after the transaction by man-machine interaction. On the basis of analyzing the goals and layers of intelligent knowledge management, this paper studies the implementation model of intelligent knowledge management from the aspects of its cultivation, expression and storage, audit and logic mechanism etc. It will afford new perspective for research on knowledge management.","the development and application of data mining technology put forward new requirement to knowledge management in information era . intelligent knowledge be the valuable knowledge that come from data mining technology , and have the intelligent feature such as memory , recognition , self-updating , disappearance etc after the transaction by man-machine interaction . on the basis of analyze the goal and layer of intelligent knowledge management , this paper study the implementation model of intelligent knowledge management from the aspect of its cultivation , expression and storage , audit and logic mechanism etc. it will afford new perspective for research on knowledge management .",95,0.5
859,Engineering_Profession,"This tutorial paper reviews the fundamentals of different methods for current decomposition and non-active power compensation in poly-phase power systems. The basic concepts and the properties of the instantaneous active and reactive power theory and of the active/reactive average power theory are discussed and critically compared.","this tutorial paper review the fundamental of different method for current decomposition and non-active power compensation in poly-phase power system . the basic concept and the property of the instantaneous active and reactive power theory and of the active/reactive average power theory be discuss and critically compare .",46,0.5
860,Engineering_Profession,"The main objective of this tutorial is to present the basic concepts on the instantaneous p-q Theory and then show its applicability for controlling switching converters connected in a micro-grid. These converters can be used for connecting renewable energy sources (solar, wind, and others) to the micro-grids or for harmonic, reactive power or unbalance compensation, and even for voltage regulation. The emphasis is given on the compensation characteristics derived from the p-q Theory, and simulation results of test cases are shown. Special attention is put on the oscillating component of the instantaneous real power, as it may produce torque oscillations or frequency variations in weak systems (micro-grids) generators. This oscillating component, as defined in the p-q Theory, gives the amount of oscillating energy between the source and the load, and its compensation through a switching compensator must have an energy storage element to exchange it with the load. With the p-q Theory this energy storage element can be easily calculated as a function of the average component of the instantaneous real power, which depends on the observation period.","the main objective of this tutorial be to present the basic concept on the instantaneous p-q theory and then show its applicability for control switch converter connect in a micro-grid . these converter can be use for connect renewable energy source -LRB- solar , wind , and other -RRB- to the micro-grid or for harmonic , reactive power or unbalance compensation , and even for voltage regulation . the emphasis be give on the compensation characteristic derive from the p-q theory , and simulation result of test case be show . special attention be put on the oscillate component of the instantaneous real power , as it may produce torque oscillation or frequency variation in weak system -LRB- micro-grid -RRB- generator . this oscillate component , as define in the p-q theory , give the amount of oscillate energy between the source and the load , and its compensation through a switch compensator must have an energy storage element to exchange it with the load . with the p-q theory this energy storage element can be easily calculate as a function of the average component of the instantaneous real power , which depend on the observation period .",178,0.16666666666666666
