document_id,category,original_text,stemmed_text,word_count,keyword_percentage
1227,Nuclear_Engineering,"This study investigate the potential biomedical application of micro/nano-aperture membrane fabricated with Polytetrafluoroethylene (PTFE). Experimental work is carried out to examine the membrane's sound transmission/absorption characteristics under the condition of different aperture diameter, thickness and cavity depth of tube. It is discovered that when there is no air layer besides the tested membrane, sound transmission is not affected. When there is sound layer, it is resonant sound absorption. In the frequency range of 100-1500Hz, it is low frequency high rate sound transmission zone. In the frequency range of 1500Hz-6300Hz, it is high frequency resonant sound absorption. It is found that PTFE as a fine sound transmission material as well as a fine sound absorption material. The original test provides a solid evidence for further research and modeling of sound transmission theory.","this study investigate the potential biomedical application of micro/nano-aperture membrane fabricate with polytetrafluoroethylene -LRB- ptfe -RRB- . experimental work be carry out to examine the membrane 's sound transmission/absorption characteristic under the condition of different aperture diameter , thickness and cavity depth of tube . it be discover that when there be no air layer besides the test membrane , sound transmission be not affect . when there be sound layer , it be resonant sound absorption . in the frequency range of 100-1500hz , it be low frequency high rate sound transmission zone . in the frequency range of 1500hz-6300hz , it be high frequency resonant sound absorption . it be find that ptfe as a fine sound transmission material as well as a fine sound absorption material . the original test provide a solid evidence for further research and modeling of sound transmission theory .",131,0.5
1228,Nuclear_Engineering,"A concept of three modules micro smart quantitative polymerase chain reaction (3M<sup>2</sup>sqPCR) is proposed and designed. The main design philosophy is to meet the ever increasing challenge of low cost, light-weighted, portable and real-time sensitive detection PCR system. The system consists of three modules: the micro-heater module, the reaction cell module and the electrochemical detection module. Experiments have been done to test performance of each module of the prototyped device. The test results reveal that the modules are sensitive and reliable, so the total 3M<sup>2</sup>sqPCR system is promising realized and suitable to perform further total analysis trials.","a concept of three module micro smart quantitative polymerase chain reaction -LRB- 3m2sqpcr -RRB- be propose and design . the main design philosophy be to meet the ever increase challenge of low cost , light-weighted , portable and real-time sensitive detection pcr system . the system consist of three module : the micro-heater module , the reaction cell module and the electrochemical detection module . experiment have be do to test performance of each module of the prototyped device . the test result reveal that the module be sensitive and reliable , so the total 3m2sqpcr system be promise realize and suitable to perform further total analysis trial .",97,0.5
1229,Nuclear_Engineering,"Two-photon-excited fluorescence (TPEF) enhancement of a semiconductor quantum dot (SQD) adsorbed on a Au nanoparticle (NP) was investigated theoretically. Surface plasmon resonance (SPR) enhancement of the exciting light and radiative rate of the SQD, and nonradiative energy transfer (NRET) from SQD to Au NP were taken into account. Compared to the unitary enhancement factor obtained from considering SPR enhancement only, TPEF enhancement factor puts up dispersive property and greatly shrinks, even more than 90 percents in special conditions. It was indicated that the peak and the valley of the TPEF enhancement curve are not consistent with the peaks of positive SPR enhancement curve and negative NRET rate curve. By tuning SPR of the Au NP to the exciting light wavelength, larger enhancement of TPEF was observed. All these should be attributed to the effect of nonradiative energy transfer from SQDs to Au NPs.","two-photon-excited fluorescence -LRB- tpef -RRB- enhancement of a semiconductor quantum dot -LRB- sqd -RRB- adsorb on a au nanoparticle -LRB- np -RRB- be investigate theoretically . surface plasmon resonance -LRB- spr -RRB- enhancement of the exciting light and radiative rate of the sqd , and nonradiative energy transfer -LRB- nret -RRB- from sqd to au np be take into account . compare to the unitary enhancement factor obtain from consider spr enhancement only , tpef enhancement factor put up dispersive property and greatly shrink , even more than 90 percent in special condition . it be indicate that the peak and the valley of the tpef enhancement curve be not consistent with the peak of positive spr enhancement curve and negative nret rate curve . by tune spr of the au np to the exciting light wavelength , large enhancement of tpef be observe . all these should be attribute to the effect of nonradiative energy transfer from sqd to au np .",143,0.75
1230,Nuclear_Engineering,"The present study has investigated the cluster deposition process of thin film formation. MD simulation has been employed to study the morphology of the collision system and to investigate the transient behavior, which occurred between the atoms of the deposited cluster and the substrate. The substrate relaxation process and the influence of the incident energy were also discussed. A traveling condition of the cluster for random incidences was applied in the simulations, and the ratio of translational and total kinetic energy of clusters were varied to observe their influence on the cluster's diffusivity. It was found that the system's reconstruction phenomena tended to recover the lattice structure, which was disordered by the impact cluster. After thermal equilibrium, the partial wetting behaviors or cluster embedded morphology were observed according to different incident energy. In the &#x201C;impact process&#x201D;, the high local temperature and high heat transfer rate were observed due to the high compressibility of the impact zone. By changing the ratio of translational and total kinetic energy of clusters, the simulation results indicated that translational kinetic energy of cluster contributed to the local temperature raising and the interpenetration of cluster atoms, while the vibrational energy benefited the spreading behaviors of cluster.","the present study have investigate the cluster deposition process of thin film formation . md simulation have be employ to study the morphology of the collision system and to investigate the transient behavior , which occur between the atom of the deposit cluster and the substrate . the substrate relaxation process and the influence of the incident energy be also discuss . a travel condition of the cluster for random incidence be apply in the simulation , and the ratio of translational and total kinetic energy of cluster be vary to observe their influence on the cluster 's diffusivity . it be find that the system 's reconstruction phenomenon tend to recover the lattice structure , which be disorder by the impact cluster . after thermal equilibrium , the partial wetting behavior or cluster embed morphology be observe accord to different incident energy . in the & # x201c ; impact process & # x201d ; , the high local temperature and high heat transfer rate be observe due to the high compressibility of the impact zone . by change the ratio of translational and total kinetic energy of cluster , the simulation result indicate that translational kinetic energy of cluster contribute to the local temperature raise and the interpenetration of cluster atom , while the vibrational energy benefit the spread behavior of cluster .",200,0.3333333333333333
1274,Photonics,"Indium bumps properties for flip-chip assembly of InAs infrared detector arrays to multiplexers have been investigated. It is shown that the indium bumps fabricated by a vacuum indium deposition and a direct photolithography, contains a surface layer more rigid in comparison with the clean indium and having a poor adhesive ability. This release layer prevents bumps from the good adhesive contact during assembly and leads to bumps disconnection under a temperature cycling because of the difference in the thermal-expansion coefficients of the InAs infrared detector arrays and the silicon multiplexer. Precise chemical removal this layer and following bumps re-flow increases the adhesion strength between indium bumps more than two order","indium bump property for flip-chip assembly of ina infrar detector array to multiplexer have be investigate . it be show that the indium bump fabricate by a vacuum indium deposition and a direct photolithography , contain a surface layer more rigid in comparison with the clean indium and have a poor adhesive ability . this release layer prevent bump from the good adhesive contact during assembly and lead to bump disconnection under a temperature cycling because of the difference in the thermal-expansion coefficient of the ina infrar detector array and the silicon multiplexer . precise chemical removal this layer and follow bump re-flow increase the adhesion strength between indium bump more than two order",110,1
1275,Photonics,"User interactivity and customisation are key features that must be promoted to help distinguish IPTV from satellite/aerial/cable TV alternatives. Furthermore, IPTV providers also have to compete with Internet TV by providing extra features to justify the cost. In this paper, we present a number of scenarios whereby IPTV providers can achieve this through the use of synchronised time. Integrating and tightly synchronising multiple user-selected media streams in Real-Time that are logically and temporally related potentially adds significant extra value to any IPTV platform. It also raises significant research challenges. We outline the prototype developed for a TV/Text Feed scenario and present some details of ongoing and future work.","user interactivity and customisation be key feature that must be promote to help distinguish iptv from satellite/aerial/cable tv alternative . furthermore , iptv provider also have to compete with internet tv by provide extra feature to justify the cost . in this paper , we present a number of scenario whereby iptv provider can achieve this through the use of synchronised time . integrate and tightly synchronise multiple user-selected medium stream in real-time that be logically and temporally relate potentially add significant extra value to any iptv platform . it also raise significant research challenge . we outline the prototype develop for a tv/text feed scenario and present some detail of ongoing and future work .",108,0.3333333333333333
1276,Photonics,"The idea of a hybrid TEM-reverberation chamber for electromagnetic immunity testing holds some appeal, because of the potential to make efficient use of RF power in producing the test electromagnetic fields. In this paper, the proposed hybrid chamber consists of an asymmetric TEM cell with a C-section stirrer fitted between the septum and the shell. Method of Moments modelling is applied to determining the field characteristics in the chamber as the stirrer rotates. This demands analysis of many data sets that represent the field parameters of the system for many discrete stirrer positions. A novel technique for analysis and visualisation of the data is described and its application to the system under investigation is demonstrated.","the idea of a hybrid tem-reverberation chamber for electromagnetic immunity testing hold some appeal , because of the potential to make efficient use of rf power in produce the test electromagnetic field . in this paper , the propose hybrid chamber consist of an asymmetric tem cell with a c-section stirrer fit between the septum and the shell . method of moment model be apply to determine the field characteristic in the chamber as the stirrer rotate . this demand analysis of many data set that represent the field parameter of the system for many discrete stirrer position . a novel technique for analysis and visualisation of the data be describe and its application to the system under investigation be demonstrate .",115,0.4
1277,Photonics,"This paper extends earlier work where we showed how multiple control agents can cooperatively regulate a crowd of people with known psychological dynamics. Keeping within the framework in which each control agent is assigned a target in the crowd and seeks to regulate that one target, we prove in this paper that if there is an intersection between any pair of the shortest paths between control agents and respective targets, then stabilization will, in a well-defined sense, not be possible. This result is appealing because it directly relates the ability to stabilize a crowd to the graph structure of the underlying crowd; moreover, the intersection condition is easily checked. The paper includes several examples and implications of the main result.","this paper extend earlier work where we show how multiple control agent can cooperatively regulate a crowd of people with known psychological dynamic . keep within the framework in which each control agent be assign a target in the crowd and seek to regulate that one target , we prove in this paper that if there be an intersection between any pair of the short path between control agent and respective target , then stabilization will , in a well-defined sense , not be possible . this result be appeal because it directly relate the ability to stabilize a crowd to the graph structure of the underlie crowd ; moreover , the intersection condition be easily check . the paper include several example and implication of the main result .",120,0
1278,Photonics,"In this paper a generic susceptibility model of a personal computer (PC) was derived using generic coupling characteristics. Coupling of interference through cables, enclosure, apertures, and directly to a circuit board were considered. Using experimental upset data for digital semiconductor components electric field intensities were calculated for an unshielded PC board and a typical PC. The obtained results show the envelope of electric field intensities at which a PC is susceptible with the minimum and maximum margins. A typical PC can be upset with an electric field strength of 48 V/m, whereas an unshielded PC board requires about 9 V/m. A typical PC is most susceptible at frequency ranges 3-500 MHz and 700-1500 MHz.","in this paper a generic susceptibility model of a personal computer -LRB- pc -RRB- be derive use generic coupling characteristic . coupling of interference through cable , enclosure , aperture , and directly to a circuit board be consider . use experimental upset data for digital semiconductor component electric field intensity be calculate for an unshielded pc board and a typical pc . the obtain result show the envelope of electric field intensity at which a pc be susceptible with the minimum and maximum margin . a typical pc can be upset with an electric field strength of 48 v/m , whereas an unshielded pc board require about 9 v/m . a typical pc be most susceptible at frequency range 3-500 mhz and 700-1500 mhz .",114,0.25
1279,Photonics,"This paper introduces a modular software platform and the respective synchronization mechanisms that support services with flexible multimodal user interfaces (UI). The platform is based on Java technology for the service logic and XML-based description languages such as SVG and VoiceXML for UI definition. A Sensor Data Manager allows including input from device sensors such as accelerometers. First of all, this paper describes the motivation for specifying a flexible and multimodal UI. Secondly, it presents how multimodal services are defined on mobile devices nowadays, followed by a description of our multimodal architecture approach. The focus lies on the integration of user input from a variety of device sensors and the respective synchronization mechanisms.","this paper introduce a modular software platform and the respective synchronization mechanism that support service with flexible multimodal user interface -LRB- ui -RRB- . the platform be base on java technology for the service logic and xml-based description language such as svg and voicexml for ui definition . a sensor data manager allow include input from device sensor such as accelerometer . first of all , this paper describe the motivation for specify a flexible and multimodal ui . secondly , it present how multimodal service be define on mobile device nowadays , follow by a description of our multimodal architecture approach . the focus lie on the integration of user input from a variety of device sensor and the respective synchronization mechanism .",113,0.6666666666666666
1280,Photonics,"Monte Carlo model of SiO<sub>x</sub> layers annealing and growth was developed. Model layers of stoichiometric SiO<sub>2</sub> with initially randomly distributed components on partially filled diamond-like lattice tends to SiO<sub>4</sub> tetrahedron formation during high-temperature annealing. Chains of tetrahedrons are found to be connected by oxygen atom. Portion of properly coordinated atoms was up to 70%. Presence of excess silicon in SiO<sub>x</sub> layers results in increasing of the portion of properly coordinated oxygen atoms (up to 95%). Starting from 17% of excess silicon nc-Si were created in annealed layer. MC simulation of initial stages of SiO<sub>2</sub> growth during dry oxidation of atomically clean Si(111) surface was carried out taking into consideration silicon monoxide formation and decomposition.","monte carlo model of siox layer anneal and growth be develop . model layer of stoichiometric sio2 with initially randomly distribute component on partially fill diamond-like lattice tend to sio4 tetrahedron formation during high-temperature annealing . chain of tetrahedron be find to be connect by oxygen atom . portion of properly coordinate atom be up to 70 % . presence of excess silicon in siox layer result in increase of the portion of properly coordinate oxygen atom -LRB- up to 95 % -RRB- . start from 17 % of excess silicon nc-si be create in annealed layer . mc simulation of initial stage of sio2 growth during dry oxidation of atomically clean si -LRB- 111 -RRB- surface be carry out take into consideration silicon monoxide formation and decomposition .",114,0.6666666666666666
1281,Photonics,"Three innovations responsible for an explosive growth in available information bandwidth over the last 30 years are highlighted. These include the invention of the bipolar and MOS transistors, development of information theory and the invention of solid-state lasers. Although demonstrated 13 years later than the bipolar transistors, fundamental contributions that led to rapid adoption of MOS as the technology of choice in meeting the needs of wireless and lightwave communication systems is explained. Continued research in understanding and improving MOSFET noise performance is elucidated. Theoretical basis of ultra-low-noise optical signal detection using finite medium and non-instantaneous multiplication are presented.","three innovation responsible for an explosive growth in available information bandwidth over the last 30 year be highlight . these include the invention of the bipolar and mo transistor , development of information theory and the invention of solid-state laser . although demonstrate 13 year later than the bipolar transistor , fundamental contribution that lead to rapid adoption of mo as the technology of choice in meet the need of wireless and lightwave communication system be explain . continue research in understanding and improve mosfet noise performance be elucidate . theoretical basis of ultra-low-noise optical signal detection use finite medium and non-instantaneous multiplication be present .",99,0.5555555555555556
1282,Photonics,"This paper presents an approach of using Google's Android software stack as an application environment for digital television (DTV) sets and set-top boxes. Expanding Android software stack to support DTV decoder devices and developing universal TV and set-top box applications for Android environment enables rapid software development and shorter release time for next generation products. Paper describes the process of porting complete Android software stack (Android Linux kernel, system drivers, user space libraries, Android specific libraries and programs) to a DTV decoder platform with Linux kernel and available stable device drivers; implementation of extensions to support DTV channel search, memorizing, playback and recording. Performance and features of final system will be presented.","this paper present an approach of use google 's android software stack as an application environment for digital television -LRB- dtv -RRB- set and set-top box . expand android software stack to support dtv decoder device and develop universal tv and set-top box application for android environment enable rapid software development and short release time for next generation product . paper describe the process of port complete android software stack -LRB- android linux kernel , system driver , user space library , android specific library and program -RRB- to a dtv decoder platform with linux kernel and available stable device driver ; implementation of extension to support dtv channel search , memorize , playback and recording . performance and feature of final system will be present .",112,0.6
1283,Photonics,"Micromachined technology has been widely used to reduce device size and improve performance. In this paper, our research activities on micromachined piezoelectric acoustic devices at wide frequency range, from audio microphones to ultrasonic transducers, are reviewed. These devices are based on ferroelectric thin films, and exceed the conventional acoustic devices in excellent performance, miniaturized size, high reliability and compatibility with conventional integrated circuit fabrication. Resonance frequency can be determined by the thickness of each layer composing the thin film. Compact arrays of these devices are designed, fabricated and characterized to enhance sensitivity and pointing. Micromachined acoustic devices could find extensive applications in practical systems.","micromachined technology have be widely use to reduce device size and improve performance . in this paper , our research activity on micromachined piezoelectric acoustic device at wide frequency range , from audio microphone to ultrasonic transducer , be review . these device be base on ferroelectric thin film , and exceed the conventional acoustic device in excellent performance , miniaturize size , high reliability and compatibility with conventional integrate circuit fabrication . resonance frequency can be determine by the thickness of each layer compose the thin film . compact array of these device be design , fabricate and characterize to enhance sensitivity and point . micromachin acoustic device could find extensive application in practical system .",104,0.6
1284,Photonics,"Performance of a L-branch predetection equal gain combining receiver has been analyzed in independent Hoyt fading channels with arbitrary fading parameters applying classical probability density function (PDF) based approach. An approximate but highly accurate PDF of the sum of independent Hoyt random variables has been used for the analysis. Simple and easy to evaluate expressions for the outage probability and amount of fading have been obtained. An expression for average symbol error rate, in the form of an infinite series with a single integral with finite limits has been obtained which is applicable for a number of M-ary coherent and noncoherent modulations. Numerically evaluated results have been compared with the published results to verify the correctness of the derived expressions.","performance of a l-branch predetection equal gain combine receiver have be analyze in independent hoyt fading channel with arbitrary fading parameter apply classical probability density function -LRB- pdf -RRB- base approach . an approximate but highly accurate pdf of the sum of independent hoyt random variable have be use for the analysis . simple and easy to evaluate expression for the outage probability and amount of fading have be obtain . an expression for average symbol error rate , in the form of an infinite series with a single integral with finite limit have be obtain which be applicable for a number of m-ary coherent and noncoherent modulation . numerically evaluate result have be compare with the publish result to verify the correctness of the derive expression .",120,0.8
