document_id,category,original_text,stemmed_text,word_count,keyword_percentage
411,Computing_and_Processing,"The long range dependence (LRD) of stationary process is characterized by the Hurst parameter. In practice, previous methods for estimation of the Hurst parameter might have poor performance when processing the non-stationary time series or trying to distinguish the slight difference between very long stochastic processes. This paper explores the use of fractional Fourier transform (FrFT) for estimating the Hurst parameter. The time series was processed locally to achieve a reliable local estimation of the Hurst parameter. The biocorrosion signal which is very popular in biological engineering was studied as an example to show the long range dependence properties. After comparing with the commonly used wavelet based method and another method based on Matlab's polyfit, the new Hurst parameter estimator proposed in this paper is proved to be more robust for non-stationarity and can show the slight difference clearly between those very long sets of biocorrosion data","the long range dependence -LRB- lrd -RRB- of stationary process be characterize by the hurst parameter . in practice , previous method for estimation of the hurst parameter might have poor performance when process the non-stationary time series or try to distinguish the slight difference between very long stochastic process . this paper explore the use of fractional fourier transform -LRB- frft -RRB- for estimate the hurst parameter . the time series be process locally to achieve a reliable local estimation of the hurst parameter . the biocorrosion signal which be very popular in biological engineering be study as an example to show the long range dependence property . after compare with the commonly use wavelet base method and another method base on matlab 's polyfit , the new hurst parameter estimator propose in this paper be prove to be more robust for non-stationarity and can show the slight difference clearly between those very long set of biocorrosion data",147,0.8
412,Computing_and_Processing,"Studies shows that electrocardiogram (ECG) computer programs perform at least equally well as human observers in ECG measurement and coding, and can replace the cardiologist in epidemiological studies and clinical trials (J. A. Kors and G. V. Herpen, 2001). However, in order to also replace the cardiologist in clinical settings, such as for out-patients, better systems are required in order to reduce ambient noise while maintaining signal sensitivity. Therefore the objective of this work was to develop an adaptive filter to remove the contaminating signal in order to better obtain and interpret the electrocardiogram (ECG) data. To achieve reliability, the real-time computing systems must be fault-tolerant. This paper proposed a fault-tolerant adaptive filter for noise cancellation of ECG signals. Comparison of the performance and reliability of non-fault-tolerant and fault-tolerant adaptive filters are performed. Experimental results showed that the fault-tolerant adaptive filter not only successfully extract the ECG signals, but also is very reliable","study show that electrocardiogram -LRB- ecg -RRB- computer program perform at least equally well as human observer in ecg measurement and coding , and can replace the cardiologist in epidemiological study and clinical trial -LRB- j. a. kors and g. v. herpen , 2001 -RRB- . however , in order to also replace the cardiologist in clinical setting , such as for out-patient , better system be require in order to reduce ambient noise while maintain signal sensitivity . therefore the objective of this work be to develop an adaptive filter to remove the contaminate signal in order to better obtain and interpret the electrocardiogram -LRB- ecg -RRB- data . to achieve reliability , the real-time computing system must be fault-tolerant . this paper propose a fault-tolerant adaptive filter for noise cancellation of ecg signal . comparison of the performance and reliability of non-fault-tolerant and fault-tolerant adaptive filter be perform . experimental result show that the fault-tolerant adaptive filter not only successfully extract the ecg signal , but also be very reliable",153,0.75
413,Computing_and_Processing,"It is a challenging idea to measure and to analyse a person's handwriting dynamics in order to detect diseases at an early stage, to control medication, or to extend available therapies. This article makes an important move towards those biomedical applications of biometrics by showing that low temperature, physical strain, or writing with the non-preferred hand (mostly left) have a bearing on human hand movement. This is measurable even for very simple kinds of hand movement, e.g., when drawing repeated backslashes. The handwriting dynamics are measured by means of a pen equipped with force and tilt sensors. Then, the parameterized script generator model proposed by Hollerbach is used in order to extract characteristic features from the measured signals, e.g., features describing deviations of measured time series from predicted model time series. The features are then used as inputs of support vector machines that classify whether the handwriting has been influenced or not. In particular for a cooled hand this can be performed with a very high accuracy","it be a challenging idea to measure and to analyze a person 's handwriting dynamic in order to detect disease at an early stage , to control medication , or to extend available therapy . this article make an important move towards those biomedical application of biometrics by show that low temperature , physical strain , or write with the non-preferred hand -LRB- mostly leave -RRB- have a bearing on human hand movement . this be measurable even for very simple kind of hand movement , e.g. , when draw repeat backslash . the handwriting dynamic be measure by mean of a pen equip with force and tilt sensor . then , the parameteriz script generator model propose by hollerbach be use in order to extract characteristic feature from the measure signal , e.g. , feature describe deviation of measured time series from predict model time series . the feature be then use as input of support vector machine that classify whether the handwriting have be influence or not . in particular for a cool hand this can be perform with a very high accuracy",167,0.75
414,Computing_and_Processing,"Receding horizon control (RHC), also known as model predictive control (MPC), is a suboptimal control scheme that solves a finite horizon open-loop optimal control problem in an infinite horizon context and yields a measured state feedback control law. A lot of efforts have been made to study the closed-loop stability, leading to various stability conditions involving constraints on either the terminal state, or the terminal cost, or the horizon size, or their different combinations. In this paper, we propose a modified RHC scheme, called adaptive terminal cost RHC (ATC-RHC). The control law generated by ATC-RHC algorithm converges to the solution of the infinite horizon optimal control problem. Moreover, it ensures the closed-loop system to be uniformly ultimately exponentially stable without imposing any constraints on the terminal state, the horizon size, or the terminal cost. Finally we show that when the horizon size is one, the underlying problems of ATC-RHC and heuristic dynamic programming (HDP) are the same. Thus, ATC-RHC can be implemented using HDP techniques without knowing the system matrix A.","recede horizon control -LRB- rhc -RRB- , also know as model predictive control -LRB- mpc -RRB- , be a suboptimal control scheme that solve a finite horizon open-loop optimal control problem in an infinite horizon context and yield a measure state feedback control law . a lot of effort have be make to study the closed-loop stability , lead to various stability condition involve constraint on either the terminal state , or the terminal cost , or the horizon size , or their different combination . in this paper , we propose a modify rhc scheme , call adaptive terminal cost rhc -LRB- atc-rhc -RRB- . the control law generate by atc-rhc algorithm converge to the solution of the infinite horizon optimal control problem . moreover , it ensure the closed-loop system to be uniformly ultimately exponentially stable without impose any constraint on the terminal state , the horizon size , or the terminal cost . finally we show that when the horizon size be one , the underlie problem of atc-rhc and heuristic dynamic programming -LRB- hdp -RRB- be the same . thus , atc-rhc can be implement use hdp technique without know the system matrix a.",171,0.75
415,Computing_and_Processing,"This work aims to develop an artificial intelligence for a helicopter pilot. That is, a system that learns to fly a helicopter the way a human pilot would. It draws on the benefits of using inverse simulation and genetic algorithms to model systems similar to human process. The goal is to define tasks for the helicopter and have the pilot find control settings that carry out those tasks. The inverse simulation technique generates the control inputs required for a desired set of motion outputs. Genetic algorithms (GA) generate feasible solutions to the inverse problem in which the helicopter's trajectory is defined as a set of way-points. The continuous controls encoding method was implemented in flying a longitudinal acceleration/deceleration maneuver. The helicopter pilot was formulated as a multi-optimization problem with four objectives imposed as penalties. The work proposed an optimization approach termed maxPenalty, which compared and returned the biggest of the four penalties. The GA attempts to maximize the fitness and while minimizing the pilot workload. The work shows some aspects of the GA-produced flight that are human-like, and the fact that humans do not move along precise trajectories.","this work aim to develop an artificial intelligence for a helicopter pilot . that be , a system that learn to fly a helicopter the way a human pilot would . it draw on the benefit of use inverse simulation and genetic algorithm to model system similar to human process . the goal be to define task for the helicopter and have the pilot find control setting that carry out those task . the inverse simulation technique generate the control input require for a desire set of motion output . genetic algorithm -LRB- ga -RRB- generate feasible solution to the inverse problem in which the helicopter 's trajectory be define as a set of way-point . the continuous control encode method be implement in fly a longitudinal acceleration/deceleration maneuver . the helicopter pilot be formulate as a multi-optimization problem with four objective impose as penalty . the work propose an optimization approach term maxpenalty , which compare and return the big of the four penalty . the ga attempt to maximize the fitness and while minimize the pilot workload . the work show some aspect of the ga-produced flight that be human-like , and the fact that human do not move along precise trajectory .",188,0.4
416,Computing_and_Processing,"In this paper by utilizing a new concept for designing logic gates based on MOBILE, we have presented new three-input XOR and XNOR gates which were based on generalized threshold gate (GTG) topology. The proposed gates use fewer elements count in comparison with other implementations which utilize MOBILE as a main part. The correct operation of XOR and XNOR gates were confirmed by using HSPICE simulator.","in this paper by utilize a new concept for design logic gate base on mobile , we have present new three-input xor and xnor gate which be base on generalize threshold gate -LRB- gtg -RRB- topology . the propose gate use few element count in comparison with other implementation which utilize mobile as a main part . the correct operation of xor and xnor gate be confirm by use hspice simulator .",66,0.4
417,Computing_and_Processing,"Requests for changes to software systems have a potential damaging effect on software projects and the life span of software. Changes can not be avoided since it seems impossible to produce complete, correct and stable requirements. Late requests for deep, structural software changes are particularly harmful. We present an approach for early detection of evolutionary changes of software requirements, especially deep structural changes that have implications for the software architecture. The approach is based on using business process modelling (BPM) as a tool to increase the level of understanding of the problem domain in early stages. This enables the system stakeholders to identify and prevent certain types of changes earlier in the development process than what is usual with most commonly used development methods. We present a possible taxonomy of changes to help managing the different types of changes that are most important for our purpose.","request for change to software system have a potential damaging effect on software project and the life span of software . change can not be avoid since it seem impossible to produce complete , correct and stable requirement . late request for deep , structural software change be particularly harmful . we present an approach for early detection of evolutionary change of software requirement , especially deep structural change that have implication for the software architecture . the approach be base on use business process modelling -LRB- bpm -RRB- as a tool to increase the level of understanding of the problem domain in early stage . this enable the system stakeholder to identify and prevent certain type of change earlier in the development process than what be usual with most commonly use development method . we present a possible taxonomy of change to help manage the different type of change that be most important for our purpose .",146,0
418,Computing_and_Processing,"The paper presents the theory of wave probabilistic models together with their features that represent basic principles of quantum informatics. These features are mathematically described and the illustrative examples are shown to demonstrate the possible applications of the presented theory. The proposed methodology represents the original approach which comes from defined mathematical assumptions like single-valuedness, resonance principle, etc. From these simple assumptions a lot of principle of quantum informatics can be derived like quantization principle, spin, entanglement, etc.","the paper present the theory of wave probabilistic model together with their feature that represent basic principle of quantum informatics . these feature be mathematically describe and the illustrative example be show to demonstrate the possible application of the present theory . the propose methodology represent the original approach which come from define mathematical assumption like single-valuednes , resonance principle , etc. from these simple assumption a lot of principle of quantum informatics can be derive like quantization principle , spin , entanglement , etc.",78,0.25
419,Computing_and_Processing,"In this paper, we propose two memoryless converters for the moduli set {2<sup>2n+1</sup> -1,2<sup>2n</sup>,2<sup>n</sup> -1}. First, we propose a novel reverse converter, which is purely adder based, using the traditional Chinese remainder theorem (CRT). Second, due to the fact that the proposed CRT based structure does not cover the entire dynamic range, a second converter, which covers the entire dynamic range based on mixed radix conversion (MRC), is proposed. The CRT based converter outperforms the MRC based converter both in terms of area and delay. In comparison with related best known state of the art converters, they are all outperformed by the proposed CRT based scheme in terms of both area cost and conversion delay. The theoretical evaluation is supported by the experimental results, which are estimated on a Standard Cell 0.13-m CMOS technology. These experimental results indicate that, on average, for the same dynamic range, the proposed CRT based converter achieves about 23% delay reduction with more than 3% area reduction, when compared to the existing state of the art MRC based converter. Additionally, the proposed CRT based converter is about 6% faster with about 4% area reduction when compared with the existing CRT based converter.","in this paper , we propose two memoryless converter for the modulus set -LCB- 22n +1 -1,22 n ,2 n -1 -RCB- . first , we propose a novel reverse converter , which be purely add base , use the traditional chinese remainder theorem -LRB- crt -RRB- . second , due to the fact that the propose crt base structure do not cover the entire dynamic range , a second converter , which cover the entire dynamic range base on mixed radix conversion -LRB- mrc -RRB- , be propose . the crt base converter outperform the mrc base converter both in term of area and delay . in comparison with related best know state of the art converter , they be all outperform by the propose crt base scheme in term of both area cost and conversion delay . the theoretical evaluation be support by the experimental result , which be estimate on a standard cell 0.13 -  m cmo technology . these experimental result indicate that , on average , for the same dynamic range , the propose crt base converter achieve about 23 % delay reduction with more than 3 % area reduction , when compare to the exist state of the art mrc base converter . additionally , the propose crt base converter be about 6 % faster with about 4 % area reduction when compare with the exist crt base converter .",197,0.8
467,Electromagnetics,"This paper presents the radiation performance of a modified elliptical patch microstrip antenna (EPMA) simulated on glass epoxy FR4 substrate material. For modification in patch geometry, two parallel narrow slits in the EPMA geometry parallel to its minor axis are applied. In this way, patch is divided in three patches. The two outer patches are identical in shape and size. The central patch is excited through inset feed and the two outer patches are gap coupled to this center patch. The modified antenna resonates at two closely spaced frequencies with much improved bandwidth (&gt; 10%). The radiation patterns of antenna at four frequencies considered in the range where antenna displays broadband behaviour are almost identical in shape and nature. The gain and directivity of antenna displays variation of less than 1 dBi within considered frequency range. The simulation results suggest that this antenna with little more improvisations may be a suitable candidate for Wi-MAX applications.","this paper present the radiation performance of a modify elliptical patch microstrip antenna -LRB- epma -RRB- simulated on glass epoxy fr4 substrate material . for modification in patch geometry , two parallel narrow slit in the epma geometry parallel to its minor axis be apply . in this way , patch be divide in three patch . the two out patch be identical in shape and size . the central patch be excite through inset feed and the two out patch be gap couple to this center patch . the modify antenna resonate at two closely spaced frequency with much improve bandwidth -LRB- &gt; 10 % -RRB- . the radiation pattern of antenna at four frequency consider in the range where antenna display broadband behavior be almost identical in shape and nature . the gain and directivity of antenna display variation of less than 1 dbi within consider frequency range . the simulation result suggest that this antenna with little more improvisation may be a suitable candidate for wi-max application .",155,0.6
468,Electromagnetics,"The series and shunt inductivity introduced by the probe and shorting pin respectively in a single-feed shorted rectangular microstrip antenna has been evaluated theoretically using transmission line method. The proposed structure provides compact dual band operation using single feed mechanism. The input impedance, VSWR, and return loss are calculated theoretically. It is found that the ratio of the resonant frequencies highly depends on the position of shorting pin.","the series and shunt inductivity introduce by the probe and short pin respectively in a single-feed shorted rectangular microstrip antenna have be evaluate theoretically use transmission line method . the propose structure provide compact dual band operation use single feed mechanism . the input impedance , vswr , and return loss be calculate theoretically . it be find that the ratio of the resonant frequency highly depend on the position of short pin .",68,0.5
469,Electromagnetics,"This paper presents the design of an ultra wide band (UWB) antenna with CPW-fed. The antenna has been designed on FR4 substrate <sub>r</sub> = 4.3 and thickness 1.53 mm. The antenna has been fabricated and tested using VNA. The experimental results of this antenna offer ultra wide bandwidth from 2.86 GHz to 14.38 GHz. This corresponds to the impedance bandwidth 11.42 GHz and 132.48 %. The experimental results also exhibits the first band from 0.62 GHz to 1.657 GHz corresponds to 1.037 GHz bandwidth. The radiation pattern of this antenna is nearly omni directional. This type of antenna can be used for ultra wide band system, positioning system, microwave imaging and Radar application.","this paper present the design of an ultra wide band -LRB- uwb -RRB- antenna with cpw-fed . the antenna have be design on fr4 substrate  r = 4.3 and thickness 1.53 mm . the antenna have be fabricate and test use vna . the experimental result of this antenna offer ultra wide bandwidth from 2.86 ghz to 14.38 ghz . this correspond to the impedance bandwidth 11.42 ghz and 132.48 % . the experimental result also exhibit the first band from 0.62 ghz to 1.657 ghz correspond to 1.037 ghz bandwidth . the radiation pattern of this antenna be nearly omni directional . this type of antenna can be use for ultra wide band system , positioning system , microwave imaging and radar application .",113,0.25
470,Electromagnetics,"The characteristics of a proximity coupled microstrip antenna, for the application in high performance local area network type 2 (HIPERLAN/2) are reported here. This miniaturized circularly polarized microstrip antenna has wide bandwidth. The simulated results using IE3D software are verified by measurement.","the characteristic of a proximity couple microstrip antenna , for the application in high performance local area network type 2 -LRB- hiperlan/2 -RRB- be report here . this miniaturize circularly polarize microstrip antenna have wide bandwidth . the simulated result use ie3d software be verify by measurement .",42,0.5
471,Electromagnetics,"In this paper, the performances of a short-circuited microstrip antenna and a proximity coupled microstrip antenna are compared at the frequency bands of wireless communications using global positioning system (GPS) and Bluetooth. Both the antennas are able to generate dual frequencies. Simulated results are verified by measurement.","in this paper , the performance of a short-circuit microstrip antenna and a proximity couple microstrip antenna be compare at the frequency band of wireless communication use global positioning system -LRB- gps -RRB- and bluetooth . both the antenna be able to generate dual frequency . simulated result be verify by measurement .",47,1
472,Electromagnetics,"This paper presents the design of Fractal Microstrip Yagi Uda Antenna. This antenna has been modeled by incorporating fractal geometry in microstrip technology applying the conventional Yagi-Uda principle. The antenna has been designed on substrate epsiv<sub>r</sub> =4.3 and h=1.53 mm using Sierpinski gasket. The Sierpinski gasket as Driver, Reflector and Director of height 80 mm, 83 mm, 77 mm respectively are used. This antenna has been simulated using FDTD code. It has been observed that Yagi - Uda antenna resonant at three frequencies i..e. 0.370 GHz, 1.795 GHz and 3.665 GHz. The radiation pattern of antenna at all frequency are as similar. The experimental resonant frequencies are in good agreement with simulated resonant frequencies.","this paper present the design of fractal microstrip yagi uda antenna . this antenna have be model by incorporate fractal geometry in microstrip technology apply the conventional yagi-uda principle . the antenna have be design on substrate epsivr = 4.3 and h = 1.53 mm use sierpinski gasket . the sierpinski gasket as driver , reflector and director of height 80 mm , 83 mm , 77 mm respectively be use . this antenna have be simulated use fdtd code . it have be observe that yagi - uda antenna resonant at three frequency i. . e. 0.370 ghz , 1.795 ghz and 3.665 ghz . the radiation pattern of antenna at all frequency be as similar . the experimental resonant frequency be in good agreement with simulated resonant frequency .",114,0
